{
  "$schema": "https://json-schema.org/draft/2020-12/schema",
  "$id": "https://docs.kombify.io/schemas/public-safety-policy.schema.json",
  "title": "Kombify public documentation safety policy",
  "type": "object",
  "additionalProperties": false,
  "required": [
    "version",
    "publicationMode",
    "allowedNavigationTabs",
    "allowedNavigationLanguages",
    "allowedExactPages",
    "allowedPagePrefixes",
    "excludedDirectories",
    "forbiddenPathPrefixes",
    "forbiddenFrontmatterKeys",
    "forbiddenContentPatterns",
    "localSmokePaths",
    "remoteForbiddenPaths",
    "remoteForbiddenMarkers"
  ],
  "properties": {
    "$schema": { "type": "string" },
    "version": { "const": 2 },
    "publicationMode": { "const": "public-only" },
    "allowedNavigationTabs": {
      "type": "array",
      "minItems": 1,
      "uniqueItems": true,
      "items": { "type": "string", "minLength": 1 }
    },
    "allowedNavigationLanguages": {
      "type": "array",
      "minItems": 1,
      "uniqueItems": true,
      "items": { "type": "string", "minLength": 2 }
    },
    "allowedExactPages": {
      "type": "array",
      "minItems": 1,
      "uniqueItems": true,
      "items": { "type": "string", "minLength": 1 }
    },
    "allowedPagePrefixes": {
      "type": "array",
      "minItems": 1,
      "uniqueItems": true,
      "items": { "type": "string", "pattern": "/$" }
    },
    "allowedOpenApiReferences": {
      "description": "Navigation OpenAPI references Mintlify may render as API pages. Each entry is the exact spec file and generated-page directory; any other openapi navigation entry fails closed.",
      "type": "array",
      "uniqueItems": true,
      "items": {
        "type": "object",
        "additionalProperties": false,
        "required": ["source", "directory"],
        "properties": {
          "source": { "type": "string", "pattern": "^[a-z0-9][a-z0-9/_-]*\\.(?:yaml|yml|json)$" },
          "directory": { "type": "string", "pattern": "^[a-z0-9][a-z0-9/_-]*[a-z0-9]$" }
        }
      }
    },
    "excludedDirectories": {
      "type": "array",
      "minItems": 1,
      "uniqueItems": true,
      "items": { "type": "string", "minLength": 1 }
    },
    "forbiddenPathPrefixes": {
      "type": "array",
      "minItems": 1,
      "uniqueItems": true,
      "items": { "type": "string", "pattern": "/$" }
    },
    "forbiddenFrontmatterKeys": {
      "type": "array",
      "minItems": 1,
      "uniqueItems": true,
      "items": { "type": "string", "pattern": "^[a-z][a-z0-9_-]*$" }
    },
    "forbiddenContentPatterns": {
      "type": "array",
      "minItems": 1,
      "items": {
        "type": "object",
        "additionalProperties": false,
        "required": ["id", "pattern"],
        "properties": {
          "id": { "type": "string", "pattern": "^[a-z][a-z0-9-]*$" },
          "pattern": { "type": "string", "minLength": 1 }
        }
      }
    },
    "localSmokePaths": {
      "type": "array",
      "minItems": 1,
      "uniqueItems": true,
      "items": { "type": "string", "pattern": "^/" }
    },
    "remoteForbiddenPaths": {
      "type": "array",
      "minItems": 1,
      "uniqueItems": true,
      "items": { "type": "string", "pattern": "^/" }
    },
    "remoteForbiddenMarkers": {
      "type": "array",
      "minItems": 1,
      "uniqueItems": true,
      "items": { "type": "string", "minLength": 1 }
    }
  }
}
