{
  "$schema": "./schemas/public-safety-policy.schema.json",
  "version": 2,
  "publicationMode": "public-only",
  "allowedNavigationTabs": [
    "Start",
    "Inicio",
    "开始使用",
    "शुरू करें",
    "ابدأ",
    "StackKits",
    "Techstack",
    "SpeechKit",
    "Identity & Access",
    "Changelog",
    "Identität & Zugriff",
    "Identidad y acceso",
    "身份与访问",
    "更新日志",
    "पहचान और एक्सेस",
    "चेंजलॉग",
    "الهوية والوصول",
    "سجل التغييرات",
    "Apps",
    "Aplicaciones",
    "应用",
    "ऐप्स",
    "التطبيقات"
  ],
  "allowedNavigationLanguages": [
    "en",
    "de",
    "es",
    "zh-Hans",
    "hi",
    "ar"
  ],
  "allowedExactPages": [
    "index",
    "identity/overview",
    "identity/how-sign-in-works",
    "changelog/overview",
    "techstack/overview",
    "techstack/install-windows",
    "techstack/operating-modes",
    "techstack/availability",
    "techstack/add-node",
    "techstack/pairing-command",
    "techstack/ssh-connection",
    "techstack/node-roles",
    "techstack/managed-servers",
    "techstack/guard/overview",
    "techstack/guard/architecture",
    "techstack/guard/protection-and-recovery"
  ],
  "allowedPagePrefixes": [
    "guides/stackkits/",
    "stackkits/",
    "techstack/reference/cli/",
    "speechkit/",
    "start/",
    "trust/",
    "apps/",
    "kombify-me/",
    "wallet/",
    "de/",
    "es/",
    "zh-Hans/",
    "hi/",
    "ar/"
  ],
  "allowedOpenApiReferences": [
    {
      "source": "techstack/reference/api/openapi.yaml",
      "directory": "techstack/reference/api"
    },
    {
      "source": "techstack/reference/api/openapi.yaml",
      "directory": "de/techstack/reference/api"
    },
    {
      "source": "techstack/reference/api/openapi.yaml",
      "directory": "es/techstack/reference/api"
    },
    {
      "source": "techstack/reference/api/openapi.yaml",
      "directory": "zh-Hans/techstack/reference/api"
    },
    {
      "source": "techstack/reference/api/openapi.yaml",
      "directory": "hi/techstack/reference/api"
    },
    {
      "source": "techstack/reference/api/openapi.yaml",
      "directory": "ar/techstack/reference/api"
    }
  ],
  "excludedDirectories": [
    ".git",
    ".mintlify",
    "node_modules"
  ],
  "forbiddenPathPrefixes": [
    "internal/",
    "operations/",
    "review/",
    "runbooks/"
  ],
  "forbiddenFrontmatterKeys": [
    "auth",
    "authentication",
    "groups",
    "private",
    "restricted"
  ],
  "forbiddenContentPatterns": [
    {
      "id": "operator-secret-name",
      "pattern": "(?i)\\b(?:AUTH0_MCP_BEARER|DOPPLER_(?:CONFIG|PROJECT|TOKEN)|RENDER_API_KEY|REPO_SYNC_PAT)\\b"
    },
    {
      "id": "internal-secret-path",
      "pattern": "(?i)\\b(?:kombination|kombify-systems)/(?:dev|prd|prd_servers|stg)\\b"
    },
    {
      "id": "provider-origin",
      "pattern": "(?i)https?://[^\\s<>()\\\"']+\\.(?:onrender\\.com|pages\\.dev|run\\.app|workers\\.dev)(?:[/:?#]|$)"
    },
    {
      "id": "live-credential-assignment",
      "pattern": "(?im)\\b(?:access[_-]?token|api[_-]?key|client[_-]?secret|password)\\b\\s*[:=]\\s*(?![\\\"']?(?:<|\\$\\{|\\{\\{|example|redacted|replace|your[-_]|x{3,}))[\\\"']?[A-Za-z0-9_./+=-]{12,}"
    }
  ],
  "localSmokePaths": [
    "/"
  ],
  "remoteForbiddenPaths": [
    "/internal",
    "/operations",
    "/review/audience-workflow",
    "/runbooks",
    "/sim/overview",
    "/api/kombifysim/overview",
    "/cloud/overview",
    "/api/kombifycloud/overview",
    "/ai/overview",
    "/platform/overview",
    "/journeys/overview",
    "/comparisons/vs-proxmox",
    "/integrations/proxmox",
    "/quickstart",
    "/quickstart-selfhosted"
  ],
  "remoteForbiddenMarkers": [
    "Documentation review workflow",
    "organization-members",
    "AUTH0_MCP_BEARER",
    "DOPPLER_TOKEN",
    "REPO_SYNC_PAT",
    "kombify Simulate",
    "Proxmox integration",
    "kombify vs Proxmox"
  ]
}
